{"algorithm":{"near_duplicate_threshold":0.95,"question_normalization":"NFKC + casefold + alphanumeric characters","version":"question-near-duplicate-v1"},"dataset_id":"p2-retrieval-v2","freeze_sha256":"49600e59d3525ac78ffadb61f667004db42752e0b80ad1bccce4e383ae4472a2","schema_version":"p2-ds05-split-freeze-v1","source_gold_dataset_sha256":"3cca068f504f5604389b251400a097915d0a0e82b45fd06f6fcab095eccb71a1","source_snapshot_dataset_sha256":"7f2440695b6f575be045e066544009a765a308544982adb8618bf5004bf418a3","splits":{"holdout":{"case_ids":["REP-T13-01","REP-T13-02","REP-T13-03","REP-T13-04","REP-T13-05","REP-T13-06","REP-T13-07","REP-T13-08","REP-T13-09","REP-T13-10","REP-T13-11","REP-T13-12","REP-T13-13","REP-T13-14","REP-T13-15","REP-T13-16","REP-T14-01","REP-T14-02","REP-T14-03","REP-T14-04","REP-T14-05","REP-T14-06","REP-T14-07","REP-T14-08","REP-T14-09","REP-T14-10","REP-T14-11","REP-T14-12","REP-T14-13","REP-T14-14","REP-T14-15","REP-T14-16","REP-T15-02","REP-T15-03","REP-T15-04","REP-T15-05","REP-T15-06","REP-T15-09","REP-T15-12","REP-T15-13","REP-T15-14","REP-T15-15","REP-T15-16","REP-T16-03","REP-T16-06","REP-T16-12","REP-T16-16","REP-T17-06","REP-T17-12","REP-T18-06"],"chunk_ids":["1a6072fa10850a32a9f38ea018ebe20307b73353dbcc1f8cb0c5ae633dd5fee8","1e406823f97f51684db7a71a54d836edb361ee46c6177c6e5b6bad6856b2b50a","1e5a7608cdae88a5ee6f1559e804a2f08a53997334fc6cf43244de71c0b1923a","1f7000bd58aefee8e66f9e0ac8fd412917044bf3a19d5221f39fb8055d1a3bc0","22c634b42c3bf2b44f44db69f12c776b31ade39b44251557400c036e3a2c2b0a","36f5a564ed5bcf54433d8e3e0c67abc49fae2773c6db8ba21ebf6871c2d28441","3f61ad4607b2edd91664e7a3354d05e274700470ec50dd2256c91b1fca8e335f","4a39aa07e6a82e2a3b124c8085ad0948a5850d198b629efef782e2fd9386cb96","6795501ae16d4f276d9e2033f131c441b94432ad62b226f57b52aa20c9a31458","6ccf00b973fbb542a5c91b1f49fd896c0c1538e37fd0f8bc4ea56980b7f83646","72e4e2110a56dc2c21dfb471e36259d5a30dd02926854e2460f7eb4c68697530","73212bce8d42976dd21032a229507243bc1c5c9c2d4cf934a2c3499f8e9b424a","7acdf0226b30e5ca1b1319ee52d5101fa0293332714b14fb0dc2051cad178f43","845c444e183997aca320f1bbde4c223f129dc2fbd745ff486c7ce9d0fcdf76f8","97589fe58d95cda364e2d2c60f390bdf22a9ba2ea6ba7d6f7497a89a69d0a5bb","b879ffd0edaf04ca4e40ff47200201bd5f213f02e0ef511833725dd88f396976","bdac3462d161c9263387f211140161a5c7cf370fe860d13c3325c1df023d15d3","c2d55d5c6321d58f08a1c09707ca9749e026280d94bb76a3aa8ac9bf8c171b5f","c4d3c75466be4ba1b1c983a5b6e36cc945d75be7299652ee4ad9abe9df7f0494","cc493083e452f5fc5094dbaa2c4d1c9b438739abd132a41bd1d27c59854066bc","ccf88db9291bbc878d67f59abec848f28e2ea53dfb8e01a7ec672ca28c73d44e","ce7b24629a746d48a28c28948b76f012d1abfa4433303af2e53bb4b8c5ca71b2","dd118b2eba23ecdf1648489429be79f78bb3213217b6eb15ec03353593e0c8ce","e33c8139ceb1e708c3eb92cff3ff8dfeecc6a1c8cd5134c1e411a29cd0a75a95"],"count":50,"document_ids":["p2rep:document:02d005f4be7f6c4d5a4ccbdc763b6f6ee5e6f0c0a33645639f82932d0e243334","p2rep:document:193cc36e4c1489568ff6b1cdd65049052c37b4534c1ec438a0cb2e25aad76f4b","p2rep:document:25fe5cee972e8294a7172d068dacef8044ad3b9d664ce2f8fec6c9af8e9802ce","p2rep:document:30766e28f0ecee066c3cde8ce587abbbce2f3508f567ecab56d0558fcdff5c37","p2rep:document:3daa8b763d6e9c8d4f1feec35811f099689c57435e905c582f2471c7a4c36999","p2rep:document:56bd100eb4d5c2fb80122aacf7120af75eaa61671586a4608d5db20578207c61","p2rep:document:66f7be20719281310fd40ea5c8a733aafd5eb1c5ee2492b7c3af653bcc3ecd64","p2rep:document:928b88290877782a20bc1054f0906102866025cb54087f823ee106993d25f6b9","p2rep:document:98b16b0c258f87642b475cae9b5345719a3c499e39888afcd72a2ccc093d3b26","p2rep:document:a64330e5bd5d417bceda5fc2b35120e264b31250548387779595a9d24e2b5085","p2rep:document:c6439f9670c1ee29916741ce926dd5cd3d8a5c29296ead3736a45113c5da38ae","p2rep:document:c7e238271f041eeb851138bfbe0487934181483e99dcea04e1f3a3a71a9a2c4a","p2rep:document:cddb7a91019a0fd602396dca5add19b1d716814449f24537ef975b103ca0efa6","p2rep:document:cf4e2826ce35b8bdbf2972589a11dd6b9a517074a07beaa5c3fb0ac34c3c10e6","p2rep:document:dc0e201f1a28d8c81cb3cefc0218840521d3db313c71244a38883314ba806f4a"],"evidence_control_ids":["DM-DELETE-RETENTION-ACT","DM-DELETE-RETENTION-ACT-DATA","DM-DELETE-RETENTION-ACT-PROC","DM-DELETE-RETENTION-DRF","DM-DELETE-RETENTION-DRF-DATA","DM-DELETE-RETENTION-DRF-PROC","DM-DELETE-RETENTION-OLD","DM-DELETE-RETENTION-OLD-PROC","DM-DISTANCE-METRIC-ACT","DM-DISTANCE-METRIC-ACT-PROC","DM-DISTANCE-METRIC-DRF","DM-DISTANCE-METRIC-OLD-PROC","DM-READINESS-ACT-PROC","DM-RERANK-GATE-ACT-PROC","DM-RERANK-GATE-OLD-PROC","DM-STALE-STATE-ACT","DM-STALE-STATE-ACT-DATA","DM-STALE-STATE-ACT-PROC","DM-STALE-STATE-DRF","DM-STALE-STATE-DRF-DATA","DM-STALE-STATE-DRF-PROC","DM-STALE-STATE-OLD","DM-STALE-STATE-OLD-PROC","DM-TOPK-LIMIT-ACT","DM-TOPK-LIMIT-ACT-DATA","DM-TOPK-LIMIT-ACT-PROC","DM-TOPK-LIMIT-DRF","DM-TOPK-LIMIT-OLD","DM-TOPK-LIMIT-OLD-PROC"],"evidence_quote_hashes":["030043d100c7a5e72fc5a4f11204b1c097c2f2afa2f32a1b67a93ef67a3cf8e0","07e7e4a27d2b20625aa30ee9a26c14f76a9b8b2c4c87436e5bab74f3dbbcdf84","0cd661e0a3bbcd8878666a812da539374c40e52c0c7966025a3733214a91e408","0db3d545ca7ce9bc189c8bd69b7c169ca2d9d5637c8bb432bb1681bfa61ef278","132885a7367b71bd0bac3b883431658de929b2be3732c3eea6252b6c82cbc1b9","1753edbe6ef5d2476d57cac4f0662567f95926f31aee5a3efa4a77b72d0266dd","1a70b1542bb831fad7c13c34f376325faf8d3c13b7ff37ee1e4f9e330b8b2280","20cd770f655a80431718bf34c63bd564975c484b9c160ec37d92e5f56d2b4270","21af6bdd4f8268b3344d92fe449c29456a1bab53ec5af4fbd9d412239ebd0254","257da6c03709292d562243ea20094f3a5071c1e29f926b0f3c00392038162f7e","36de6203c07efd1aee5c84b0ebec053ab33cb8274ff01a97cb44598d272d3f0b","400a90f5b7805e08c209bb1d066674f9afec055e9d8d0d5baf9b1f740e0abefd","41723d07873c238525bedc8084c86c051478e61e58efcc82a6fd18e6f5679d04","48f03f6eec6c477df3d96ba77f8f19ee5c4c2de58359a8121129f04ad491de3f","6817d7a27d3e313edc23d85fb6a243a603893bd371e04af0e396fe15e6002934","75252b5f338b355674fe706bdcd8dd23f3e35ee05e1c41d627850b3f3edcd2bd","77c2ede6bf9817a9330ff04b39382bbef3c4f95675cb9322bad3f26dfb04cdec","812bfab323fbf9882eec1a42856d55e8972564ffa8aa7460f99190b73a8b8926","83c2fa4606f068673c1d024c00fe534a12e2f35b86c77740fdbc7edb87ef80f7","83ccd3294d554c7ae54a329b700c5331458ade41fbada436f2583a04aebfb8c4","8defe4552b7dd3429a136954fce20420397ee1abe75742ba6cd34ab6c2fcd4c2","933ce2f64317a99f2bcc2fcca062e1d0c20a3051cd2e2df992a111d32967adee","934d89bcee78409ce88b5bcc3105cbf69fd38032d275854a9d4d4ec2723b253e","b3ef069c5d7b37b340bcd70d362cdb35637b96e83066a6a00b1869be3fe57507","bd605943debe6c53fae873eca02750d3cef293f578b72d1f2b674643097c2be2","c0976119a791b47acf3f07c28032e22c48fc1c14256b7ec0476333d540875c0c","e79ad39a3d09897cce758b037db8a690f95e9d082cd06933483bbdc0cc563daa","e94c1a31457f716167fc58277f263de1fceb1d6b14ab29ed76259a84b12ff9fe","fbda81c501b5114b7f337c87a09365f972ac8cdc8f47b2b621c0eba5cb5ff6da"],"fact_family_ids":["t13-fact-01","t13-fact-02","t13-fact-03","t13-fact-04","t13-fact-05","t13-fact-06","t13-fact-07","t13-fact-08","t13-fact-09","t13-fact-10","t13-fact-11","t13-fact-12","t13-fact-13","t13-fact-14","t13-fact-15","t13-fact-16","t14-fact-01","t14-fact-02","t14-fact-03","t14-fact-04","t14-fact-05","t14-fact-06","t14-fact-07","t14-fact-08","t14-fact-09","t14-fact-10","t14-fact-11","t14-fact-12","t14-fact-13","t14-fact-14","t14-fact-15","t14-fact-16","t15-fact-02","t15-fact-03","t15-fact-04","t15-fact-05","t15-fact-06","t15-fact-09","t15-fact-12","t15-fact-13","t15-fact-14","t15-fact-15","t15-fact-16","t16-fact-03","t16-fact-06","t16-fact-12","t16-fact-16","t17-fact-06","t17-fact-12","t18-fact-06"],"qrel_pair_ids":["p2rep:document:02d005f4be7f6c4d5a4ccbdc763b6f6ee5e6f0c0a33645639f82932d0e243334::bdac3462d161c9263387f211140161a5c7cf370fe860d13c3325c1df023d15d3","p2rep:document:02d005f4be7f6c4d5a4ccbdc763b6f6ee5e6f0c0a33645639f82932d0e243334::cc493083e452f5fc5094dbaa2c4d1c9b438739abd132a41bd1d27c59854066bc","p2rep:document:193cc36e4c1489568ff6b1cdd65049052c37b4534c1ec438a0cb2e25aad76f4b::1e406823f97f51684db7a71a54d836edb361ee46c6177c6e5b6bad6856b2b50a","p2rep:document:193cc36e4c1489568ff6b1cdd65049052c37b4534c1ec438a0cb2e25aad76f4b::ce7b24629a746d48a28c28948b76f012d1abfa4433303af2e53bb4b8c5ca71b2","p2rep:document:25fe5cee972e8294a7172d068dacef8044ad3b9d664ce2f8fec6c9af8e9802ce::6ccf00b973fbb542a5c91b1f49fd896c0c1538e37fd0f8bc4ea56980b7f83646","p2rep:document:25fe5cee972e8294a7172d068dacef8044ad3b9d664ce2f8fec6c9af8e9802ce::c2d55d5c6321d58f08a1c09707ca9749e026280d94bb76a3aa8ac9bf8c171b5f","p2rep:document:30766e28f0ecee066c3cde8ce587abbbce2f3508f567ecab56d0558fcdff5c37::22c634b42c3bf2b44f44db69f12c776b31ade39b44251557400c036e3a2c2b0a","p2rep:document:30766e28f0ecee066c3cde8ce587abbbce2f3508f567ecab56d0558fcdff5c37::ccf88db9291bbc878d67f59abec848f28e2ea53dfb8e01a7ec672ca28c73d44e","p2rep:document:3daa8b763d6e9c8d4f1feec35811f099689c57435e905c582f2471c7a4c36999::7acdf0226b30e5ca1b1319ee52d5101fa0293332714b14fb0dc2051cad178f43","p2rep:document:56bd100eb4d5c2fb80122aacf7120af75eaa61671586a4608d5db20578207c61::845c444e183997aca320f1bbde4c223f129dc2fbd745ff486c7ce9d0fcdf76f8","p2rep:document:66f7be20719281310fd40ea5c8a733aafd5eb1c5ee2492b7c3af653bcc3ecd64::6795501ae16d4f276d9e2033f131c441b94432ad62b226f57b52aa20c9a31458","p2rep:document:928b88290877782a20bc1054f0906102866025cb54087f823ee106993d25f6b9::b879ffd0edaf04ca4e40ff47200201bd5f213f02e0ef511833725dd88f396976","p2rep:document:98b16b0c258f87642b475cae9b5345719a3c499e39888afcd72a2ccc093d3b26::1f7000bd58aefee8e66f9e0ac8fd412917044bf3a19d5221f39fb8055d1a3bc0","p2rep:document:98b16b0c258f87642b475cae9b5345719a3c499e39888afcd72a2ccc093d3b26::36f5a564ed5bcf54433d8e3e0c67abc49fae2773c6db8ba21ebf6871c2d28441","p2rep:document:a64330e5bd5d417bceda5fc2b35120e264b31250548387779595a9d24e2b5085::1e5a7608cdae88a5ee6f1559e804a2f08a53997334fc6cf43244de71c0b1923a","p2rep:document:c6439f9670c1ee29916741ce926dd5cd3d8a5c29296ead3736a45113c5da38ae::72e4e2110a56dc2c21dfb471e36259d5a30dd02926854e2460f7eb4c68697530","p2rep:document:c6439f9670c1ee29916741ce926dd5cd3d8a5c29296ead3736a45113c5da38ae::